consulta,categoria,respuesta,respuesta_compuesta,respuestas_compuestas
¿Cómo me inscribo al próximo semestre?,matriculas,"Para inscribirte al próximo semestre, debes ingresar al portal estudiantil con tu usuario y contraseña, seleccionar la opción 'Inscripción', elegir las materias que cursarás y finalmente generar tu comprobante de pago. El plazo de inscripción es del 15 al 30 de julio.","Para me inscribo al próximo semestre, Para inscribirte al próximo semestre, debes ingresar al portal estudiantil con tu usuario y contraseña, seleccionar la opción 'Inscripción', elegir las materias que cursarás y finalmente generar tu comprobante de pago. El plazo de inscripción es del 15 al 30 de julio.","Para inscribirte inscribo al próximo semestre, Para inscribirte al próximo semestre, debes ingresar al portal estudiantil con tu usuario y contraseña, seleccionar la opción 'Inscripción', elegir las materias que cursarás y finalmente generar tu comprobante de pago. El plazo de inscripción es del 15 al 30 de julio."
¿Cuál es la fecha límite para inscribirse?,matriculas,"La fecha límite para completar tu inscripción es el 30 de julio. Después de esta fecha, deberás solicitar un permiso especial en la secretaría académica y posiblemente pagar un recargo por inscripción tardía.","La la fecha límite para inscribirse es, La fecha límite para completar tu inscripción es el 30 de julio. Después de esta fecha, deberás solicitar un permiso especial en la secretaría académica y posiblemente pagar un recargo por inscripción tardía.","La la fecha límite para inscribirse es, La fecha límite para completar tu inscripción es el 30 de julio. Después de esta fecha, deberás solicitar un permiso especial en la secretaría académica y posiblemente pagar un recargo por inscripción tardía."
¿Qué documentos necesito para la matrícula?,matriculas,"Para realizar tu matrícula necesitas: identificación oficial vigente, comprobante de domicilio reciente, certificado del nivel educativo anterior, 4 fotografías tamaño carnet y el comprobante de pago de la cuota de inscripción.","Lo que necesitas saber sobre documentos necesito para la matrícula es, Para realizar tu matrícula necesitas: identificación oficial vigente, comprobante de domicilio reciente, certificado del nivel educativo anterior, 4 fotografías tamaño carnet y el comprobante de pago de la cuota de inscripción.","Lo que necesitas saber sobre documentos necesito para la matrícula es, Para realizar tu matrícula necesitas: identificación oficial vigente, comprobante de domicilio reciente, certificado del nivel educativo anterior, 4 fotografías tamaño carnet y el comprobante de pago de la cuota de inscripción."
¿Cuánto cuesta la inscripción?,matriculas,"El costo de inscripción para el semestre actual es de $2,500 pesos. Este monto incluye el derecho a materias, seguro estudiantil y acceso a instalaciones. No incluye material didáctico ni libros de texto.","El valor relacionado con cuesta la inscripción es, El costo de inscripción para el semestre actual es de $2,500 pesos. Este monto incluye el derecho a materias, seguro estudiantil y acceso a instalaciones. No incluye material didáctico ni libros de texto.","El valor relacionado con cuesta la inscripción es, El costo de inscripción para el semestre actual es de $2,500 pesos. Este monto incluye el derecho a materias, seguro estudiantil y acceso a instalaciones. No incluye material didáctico ni libros de texto."
¿Dónde puedo pagar mi matrícula?,matriculas,"Puedes pagar tu matrícula en cualquier sucursal bancaria con la ficha de pago que generes en el portal estudiantil, mediante transferencia bancaria, o directamente en la caja de la institución ubicada en el edificio administrativo de lunes a viernes de 8:00 a 14:00 horas.","Puedes hacerlo en el lugar donde, Puedes pagar tu matrícula en cualquier sucursal bancaria con la ficha de pago que generes en el portal estudiantil, mediante transferencia bancaria, o directamente en la caja de la institución ubicada en el edificio administrativo de lunes a viernes de 8:00 a 14:00 horas.","Puedes realizarlo en el lugar donde, Puedes pagar tu matrícula en cualquier sucursal bancaria con la ficha de pago que generes en el portal estudiantil, mediante transferencia bancaria, o directamente en la caja de la institución ubicada en el edificio administrativo de lunes a viernes de 8:00 a 14:00 horas."
¿Hay descuentos en la matrícula?,matriculas,"Sí, ofrecemos descuentos en la matrícula por: promedio académico destacado (15% con promedio superior a 9.0), hermanos inscritos (10% al segundo hermano), pago anticipado (5% pagando antes del 5 de julio) y convenios institucionales (verificar en caja).","Con respecto a tu pregunta sobre hay descuentos en la matrícula,, Sí, ofrecemos descuentos en la matrícula por: promedio académico destacado (15% con promedio superior a 9.0), hermanos inscritos (10% al segundo hermano), pago anticipado (5% pagando antes del 5 de julio) y convenios institucionales (verificar en caja).","Con respecto a tu pregunta sobre hay descuentos en la matrícula,, Sí, ofrecemos descuentos en la matrícula por: promedio académico destacado (15% con promedio superior a 9.0), hermanos inscritos (10% al segundo hermano), pago anticipado (5% pagando antes del 5 de julio) y convenios institucionales (verificar en caja)."
¿Puedo pagar la matrícula en cuotas?,matriculas,"Sí, contamos con un plan de pagos en 3 cuotas. La primera cuota (50%) debe pagarse al momento de la inscripción, la segunda (25%) antes del 15 de septiembre y la tercera (25%) antes del 15 de octubre. Debes firmar un convenio en el departamento de finanzas.","Con respecto a tu pregunta sobre puedo pagar la matrícula en cuotas,, Sí, contamos con un plan de pagos en 3 cuotas. La primera cuota (50%) debe pagarse al momento de la inscripción, la segunda (25%) antes del 15 de septiembre y la tercera (25%) antes del 15 de octubre. Debes firmar un convenio en el departamento de finanzas.","Con respecto a tu pregunta sobre puedo pagar la matrícula en cuotas,, Sí, contamos con un plan de pagos en 3 cuotas. La primera cuota (50%) debe pagarse al momento de la inscripción, la segunda (25%) antes del 15 de septiembre y la tercera (25%) antes del 15 de octubre. Debes firmar un convenio en el departamento de finanzas."
Necesito información sobre inscripción,matriculas,"El proceso de inscripción se realiza en el portal estudiantil. Las fechas para el próximo semestre son del 15 al 30 de julio. Necesitarás tu usuario, contraseña y tener claras las materias que deseas cursar. Si tienes problemas con el acceso, puedes acudir al departamento de sistemas.","Lo que necesitas es, El proceso de inscripción se realiza en el portal estudiantil. Las fechas para el próximo semestre son del 15 al 30 de julio. Necesitarás tu usuario, contraseña y tener claras las materias que deseas cursar. Si tienes problemas con el acceso, puedes acudir al departamento de sistemas.","Lo que necesitas es, El proceso de inscripción se realiza en el portal estudiantil. Las fechas para el próximo semestre son del 15 al 30 de julio. Necesitarás tu usuario, contraseña y tener claras las materias que deseas cursar. Si tienes problemas con el acceso, puedes acudir al departamento de sistemas."
¿Qué pasos debo seguir para renovar mi inscripción académica?,matriculas,"Ingresa al portal estudiantil, selecciona 'Renovación de inscripción', confirma tus datos personales y genera tu comprobante de pago.","Lo que necesitas saber sobre pasos debo seguir para renovar mi inscripción académica es, Ingresa al portal estudiantil, selecciona 'Renovación de inscripción', confirma tus datos personales y genera tu comprobante de pago.","Lo que necesitas saber sobre pasos debo seguir para renovar mi inscripción académica es, Ingresa al portal estudiantil, selecciona 'Renovación de inscripción', confirma tus datos personales y genera tu comprobante de pago."
Tengo dudas sobre el proceso de matrícula,matriculas,"El proceso de matrícula consta de 4 pasos: 1) Acceso al portal estudiantil, 2) Selección de materias, 3) Generación de ficha de pago, 4) Pago y confirmación. Si tienes dudas específicas, puedes contactar a servicios escolares al correo servescolares@institucion.edu.","Con respecto a tu pregunta sobre tengo dudas sobre el proceso de matrícula,, El proceso de matrícula consta de 4 pasos: 1) Acceso al portal estudiantil, 2) Selección de materias, 3) Generación de ficha de pago, 4) Pago y confirmación. Si tienes dudas específicas, puedes contactar a servicios escolares al correo servescolares@institucion.edu.","Con respecto a tu pregunta sobre tengo dudas sobre el proceso de matrícula,, El proceso de matrícula consta de 4 pasos: 1) Acceso al portal estudiantil, 2) Selección de materias, 3) Generación de ficha de pago, 4) Pago y confirmación. Si tienes dudas específicas, puedes contactar a servicios escolares al correo servescolares@institucion.edu."
¿Cuál es la fecha límite para completar la inscripción?,matriculas,La fecha límite para completar tu inscripción es el 30 de julio. Después deberás pagar un recargo por tardanza.,"La la fecha límite para completar la inscripción es, La fecha límite para completar tu inscripción es el 30 de julio. Después deberás pagar un recargo por tardanza.","La la fecha límite para completar la inscripción es, La fecha límite para completar tu inscripción es el 30 de julio. Después deberás pagar un recargo por tardanza."
No puedo entrar al sistema de inscripciones,matriculas,"Si tienes problemas para acceder al sistema de inscripciones, verifica tu conexión a internet, limpia el caché de tu navegador e intenta con otro navegador. Si el problema persiste, contacta al departamento de sistemas al correo sistemas@institucion.edu o acude personalmente con tu identificación.","Con respecto a tu pregunta sobre no puedo entrar al sistema de inscripciones,, Si tienes problemas para acceder al sistema de inscripciones, verifica tu conexión a internet, limpia el caché de tu navegador e intenta con otro navegador. Si el problema persiste, contacta al departamento de sistemas al correo sistemas@institucion.edu o acude personalmente con tu identificación.","Con respecto a tu pregunta sobre no puedo entrar al sistema de inscripciones,, Si tienes problemas para acceder al sistema de inscripciones, verifica tu conexión a internet, limpia el caché de tu navegador e intenta con otro navegador. Si el problema persiste, contacta al departamento de sistemas al correo sistemas@institucion.edu o acude personalmente con tu identificación."
¿Qué pasa si me inscribo tarde?,matriculas,"Si te inscribes durante el periodo extraordinario (1-5 de agosto), deberás pagar un recargo del 10% sobre el costo de la matrícula. Además, la disponibilidad de cupos en los grupos será limitada y podrías no encontrar lugar en los horarios que prefieras.","Lo que necesitas saber sobre pasa si me inscribo tarde es, Si te inscribes durante el periodo extraordinario (1-5 de agosto), deberás pagar un recargo del 10% sobre el costo de la matrícula. Además, la disponibilidad de cupos en los grupos será limitada y podrías no encontrar lugar en los horarios que prefieras.","Lo que necesitas saber sobre pasa si me inscribo tarde es, Si te inscribes durante el periodo extraordinario (1-5 de agosto), deberás pagar un recargo del 10% sobre el costo de la matrícula. Además, la disponibilidad de cupos en los grupos será limitada y podrías no encontrar lugar en los horarios que prefieras."
¿Necesito estar al corriente en mis pagos para inscribirme?,matriculas,"Sí, para realizar tu inscripción al nuevo semestre debes estar al corriente en tus pagos anteriores. El sistema verificará automáticamente que no tengas adeudos pendientes. Si tienes algún adeudo, deberás liquidarlo antes de poder inscribirte.","Lo que necesitas es, Sí, para realizar tu inscripción al nuevo semestre debes estar al corriente en tus pagos anteriores. El sistema verificará automáticamente que no tengas adeudos pendientes. Si tienes algún adeudo, deberás liquidarlo antes de poder inscribirte.","Lo que necesitas es, Sí, para realizar tu inscripción al nuevo semestre debes estar al corriente en tus pagos anteriores. El sistema verificará automáticamente que no tengas adeudos pendientes. Si tienes algún adeudo, deberás liquidarlo antes de poder inscribirte."
¿Se puede hacer la inscripción en línea?,matriculas,"Sí, todo el proceso de inscripción puede realizarse en línea a través del portal estudiantil (www.portalestudiantil.institucion.edu). Solo necesitarás acudir presencialmente si tienes algún caso especial que requiera atención personalizada.","Con respecto a tu pregunta sobre se puede hacer la inscripción en línea,, Sí, todo el proceso de inscripción puede realizarse en línea a través del portal estudiantil (www.portalestudiantil.institucion.edu). Solo necesitarás acudir presencialmente si tienes algún caso especial que requiera atención personalizada.","Con respecto a tu pregunta sobre se puede hacer la inscripción en línea,, Sí, todo el proceso de inscripción puede realizarse en línea a través del portal estudiantil (www.portalestudiantil.institucion.edu). Solo necesitarás acudir presencialmente si tienes algún caso especial que requiera atención personalizada."
¿A qué hora comienzan las clases?,horarios,"Las clases matutinas comienzan a las 7:00 AM, el turno vespertino inicia a las 2:00 PM y las clases nocturnas a partir de las 6:00 PM. Te recomendamos llegar 15 minutos antes para ubicar tu aula.","Con respecto a tu pregunta sobre a qué hora comienzan las clases,, Las clases matutinas comienzan a las 7:00 AM, el turno vespertino inicia a las 2:00 PM y las clases nocturnas a partir de las 6:00 PM. Te recomendamos llegar 15 minutos antes para ubicar tu aula.","Con respecto a tu pregunta sobre a qué hora comienzan las clases,, Las clases matutinas comienzan a las 7:00 AM, el turno vespertino inicia a las 2:00 PM y las clases nocturnas a partir de las 6:00 PM. Te recomendamos llegar 15 minutos antes para ubicar tu aula."
¿Dónde puedo ver mi horario?,horarios,"Puedes consultar tu horario en el portal estudiantil, sección 'Horario actual'. También está publicado en las vitrinas del edificio principal y puedes solicitar una copia impresa en la secretaría académica presentando tu credencial.","Puedes hacerlo en el lugar donde, Puedes consultar tu horario en el portal estudiantil, sección 'Horario actual'. También está publicado en las vitrinas del edificio principal y puedes solicitar una copia impresa en la secretaría académica presentando tu credencial.","Puedes realizarlo en el lugar donde, Puedes consultar tu horario en el portal estudiantil, sección 'Horario actual'. También está publicado en las vitrinas del edificio principal y puedes solicitar una copia impresa en la secretaría académica presentando tu credencial."
¿Cuándo termina el semestre actual?,horarios,El semestre actual finaliza el 15 de diciembre. La última semana (9-15 de diciembre) está destinada a exámenes finales. Las calificaciones estarán disponibles a partir del 20 de diciembre en el portal estudiantil.,"El momento indicado para termina el semestre actual es, El semestre actual finaliza el 15 de diciembre. La última semana (9-15 de diciembre) está destinada a exámenes finales. Las calificaciones estarán disponibles a partir del 20 de diciembre en el portal estudiantil.","El momento indicado para termina el semestre actual es, El semestre actual finaliza el 15 de diciembre. La última semana (9-15 de diciembre) está destinada a exámenes finales. Las calificaciones estarán disponibles a partir del 20 de diciembre en el portal estudiantil."
¿Cuáles son los horarios de atención de secretaría?,horarios,"La secretaría académica atiende de lunes a viernes de 8:00 AM a 2:00 PM y de 4:00 PM a 7:00 PM. Los sábados solo de 9:00 AM a 12:00 PM. Durante periodos vacacionales, el horario se reduce de 10:00 AM a 2:00 PM.","Con respecto a tu pregunta sobre cuáles son los horarios de atención de secretaría,, La secretaría académica atiende de lunes a viernes de 8:00 AM a 2:00 PM y de 4:00 PM a 7:00 PM. Los sábados solo de 9:00 AM a 12:00 PM. Durante periodos vacacionales, el horario se reduce de 10:00 AM a 2:00 PM.","Con respecto a tu pregunta sobre cuáles son los horarios de atención de secretaría,, La secretaría académica atiende de lunes a viernes de 8:00 AM a 2:00 PM y de 4:00 PM a 7:00 PM. Los sábados solo de 9:00 AM a 12:00 PM. Durante periodos vacacionales, el horario se reduce de 10:00 AM a 2:00 PM."
¿Hay clases durante la semana santa?,horarios,No hay clases durante la semana santa. El periodo vacacional comprende del 14 al 20 de abril. Las actividades académicas se reanudan el lunes 21 de abril en sus horarios habituales.,"Con respecto a tu pregunta sobre hay clases durante la semana santa,, No hay clases durante la semana santa. El periodo vacacional comprende del 14 al 20 de abril. Las actividades académicas se reanudan el lunes 21 de abril en sus horarios habituales.","Con respecto a tu pregunta sobre hay clases durante la semana santa,, No hay clases durante la semana santa. El periodo vacacional comprende del 14 al 20 de abril. Las actividades académicas se reanudan el lunes 21 de abril en sus horarios habituales."
¿Cuándo inician los exámenes finales?,horarios,Los exámenes finales inician el 9 de diciembre y concluyen el 15 de diciembre. El calendario específico por materia se publica dos semanas antes en el portal estudiantil y en las vitrinas de cada departamento.,"El momento indicado para inician los exámenes finales es, Los exámenes finales inician el 9 de diciembre y concluyen el 15 de diciembre. El calendario específico por materia se publica dos semanas antes en el portal estudiantil y en las vitrinas de cada departamento.","El momento indicado para inician los exámenes finales es, Los exámenes finales inician el 9 de diciembre y concluyen el 15 de diciembre. El calendario específico por materia se publica dos semanas antes en el portal estudiantil y en las vitrinas de cada departamento."
Necesito saber el horario de biblioteca,horarios,"La biblioteca está abierta de lunes a viernes de 7:00 AM a 9:00 PM y los sábados de 8:00 AM a 2:00 PM. Durante periodo de exámenes, se extiende el horario hasta las 11:00 PM de lunes a viernes.","Lo que necesitas es, La biblioteca está abierta de lunes a viernes de 7:00 AM a 9:00 PM y los sábados de 8:00 AM a 2:00 PM. Durante periodo de exámenes, se extiende el horario hasta las 11:00 PM de lunes a viernes.","Lo que necesitas es, La biblioteca está abierta de lunes a viernes de 7:00 AM a 9:00 PM y los sábados de 8:00 AM a 2:00 PM. Durante periodo de exámenes, se extiende el horario hasta las 11:00 PM de lunes a viernes."
¿Cuándo es el periodo de exámenes extraordinarios?,horarios,El periodo de exámenes extraordinarios es del 8 al 19 de enero. Debes inscribirte previamente en el departamento de servicios escolares y cubrir el costo correspondiente por cada materia a presentar.,"El momento indicado para es el periodo de exámenes extraordinarios es, El periodo de exámenes extraordinarios es del 8 al 19 de enero. Debes inscribirte previamente en el departamento de servicios escolares y cubrir el costo correspondiente por cada materia a presentar.","El momento indicado para es el periodo de exámenes extraordinarios es, El periodo de exámenes extraordinarios es del 8 al 19 de enero. Debes inscribirte previamente en el departamento de servicios escolares y cubrir el costo correspondiente por cada materia a presentar."
¿A qué hora cierran las instalaciones?,horarios,Las instalaciones del campus cierran a las 10:00 PM de lunes a viernes y a las 3:00 PM los sábados. Los domingos permanecen cerradas excepto por eventos especiales programados con anticipación.,"Con respecto a tu pregunta sobre a qué hora cierran las instalaciones,, Las instalaciones del campus cierran a las 10:00 PM de lunes a viernes y a las 3:00 PM los sábados. Los domingos permanecen cerradas excepto por eventos especiales programados con anticipación.","Con respecto a tu pregunta sobre a qué hora cierran las instalaciones,, Las instalaciones del campus cierran a las 10:00 PM de lunes a viernes y a las 3:00 PM los sábados. Los domingos permanecen cerradas excepto por eventos especiales programados con anticipación."
¿Cuándo inician las clases del próximo semestre?,horarios,"Las clases del próximo semestre inician el 15 de agosto. La primera semana se considera de inducción para estudiantes de nuevo ingreso, mientras que los estudiantes regulares comienzan directamente con sus actividades académicas.","El momento indicado para inician las clases del próximo semestre es, Las clases del próximo semestre inician el 15 de agosto. La primera semana se considera de inducción para estudiantes de nuevo ingreso, mientras que los estudiantes regulares comienzan directamente con sus actividades académicas.","El momento indicado para inician las clases del próximo semestre es, Las clases del próximo semestre inician el 15 de agosto. La primera semana se considera de inducción para estudiantes de nuevo ingreso, mientras que los estudiantes regulares comienzan directamente con sus actividades académicas."
¿Cuál es el horario de la cafetería?,horarios,"La cafetería principal opera de lunes a viernes de 7:00 AM a 8:00 PM y sábados de 8:00 AM a 2:00 PM. El desayuno se sirve de 7:00 a 10:30 AM, la comida de 12:00 a 4:00 PM y la cena de 6:00 a 8:00 PM.","La el horario de la cafetería es, La cafetería principal opera de lunes a viernes de 7:00 AM a 8:00 PM y sábados de 8:00 AM a 2:00 PM. El desayuno se sirve de 7:00 a 10:30 AM, la comida de 12:00 a 4:00 PM y la cena de 6:00 a 8:00 PM.","La el horario de la cafetería es, La cafetería principal opera de lunes a viernes de 7:00 AM a 8:00 PM y sábados de 8:00 AM a 2:00 PM. El desayuno se sirve de 7:00 a 10:30 AM, la comida de 12:00 a 4:00 PM y la cena de 6:00 a 8:00 PM."
¿Hay un calendario académico disponible?,horarios,"Sí, el calendario académico completo está disponible en el portal estudiantil en la sección 'Calendario'. También puedes encontrarlo impreso en las vitrinas de cada edificio y solicitar una copia en servicios escolares.","Con respecto a tu pregunta sobre hay un calendario académico disponible,, Sí, el calendario académico completo está disponible en el portal estudiantil en la sección 'Calendario'. También puedes encontrarlo impreso en las vitrinas de cada edificio y solicitar una copia en servicios escolares.","Con respecto a tu pregunta sobre hay un calendario académico disponible,, Sí, el calendario académico completo está disponible en el portal estudiantil en la sección 'Calendario'. También puedes encontrarlo impreso en las vitrinas de cada edificio y solicitar una copia en servicios escolares."
¿Puedo tomar clases en turno vespertino y matutino?,horarios,"Sí, puedes combinar clases de diferentes turnos siempre que no existan traslapes de horario y cumplas con los prerrequisitos de las materias. Te recomendamos verificar la distancia entre edificios si tus clases son consecutivas.","Con respecto a tu pregunta sobre puedo tomar clases en turno vespertino y matutino,, Sí, puedes combinar clases de diferentes turnos siempre que no existan traslapes de horario y cumplas con los prerrequisitos de las materias. Te recomendamos verificar la distancia entre edificios si tus clases son consecutivas.","Con respecto a tu pregunta sobre puedo tomar clases en turno vespertino y matutino,, Sí, puedes combinar clases de diferentes turnos siempre que no existan traslapes de horario y cumplas con los prerrequisitos de las materias. Te recomendamos verificar la distancia entre edificios si tus clases son consecutivas."
¿A qué hora abren las puertas de la institución?,horarios,Las puertas de la institución abren a las 6:30 AM de lunes a viernes y a las 7:30 AM los sábados. El acceso temprano está disponible solo por la entrada principal y requiere mostrar tu credencial al personal de seguridad.,"Con respecto a tu pregunta sobre a qué hora abren las puertas de la institución,, Las puertas de la institución abren a las 6:30 AM de lunes a viernes y a las 7:30 AM los sábados. El acceso temprano está disponible solo por la entrada principal y requiere mostrar tu credencial al personal de seguridad.","Con respecto a tu pregunta sobre a qué hora abren las puertas de la institución,, Las puertas de la institución abren a las 6:30 AM de lunes a viernes y a las 7:30 AM los sábados. El acceso temprano está disponible solo por la entrada principal y requiere mostrar tu credencial al personal de seguridad."
¿Cómo solicito una constancia de estudios?,tramites,"Para solicitar una constancia de estudios, debes llenar el formato disponible en servicios escolares o descargarlo del portal estudiantil, realizar el pago de $150 pesos en caja y entregar el comprobante. El documento estará listo en 3 días hábiles.","Para solicito una constancia de estudios, Para solicitar una constancia de estudios, debes llenar el formato disponible en servicios escolares o descargarlo del portal estudiantil, realizar el pago de $150 pesos en caja y entregar el comprobante. El documento estará listo en 3 días hábiles.","Cómo solicito una constancia de estudios, Para solicitar una constancia de estudios, debes llenar el formato disponible en servicios escolares o descargarlo del portal estudiantil, realizar el pago de $150 pesos en caja y entregar el comprobante. El documento estará listo en 3 días hábiles."
