consulta,categoria,respuesta,respuesta_compuesta,respuestas_compuestas
¿Cómo puedo obtener una constancia de egreso?,tramites,Solicítala en servicios escolares con tu credencial y comprobante de no adeudo. El documento se entrega en 3 días hábiles.,"Para puedo obtener una constancia de egreso, Solicítala en servicios escolares con tu credencial y comprobante de no adeudo. El documento se entrega en 3 días hábiles.","Para obtener una constancia de egreso, Solicítala en servicios escolares con tu credencial y comprobante de no adeudo. El documento se entrega en 3 días hábiles."
¿Dónde gestiono mi número de NSS para el seguro?,tramites,Puedes gestionarlo en línea desde el portal del IMSS o asistir al módulo de servicios estudiantiles con tu CURP y comprobante de domicilio.,"Puedes hacerlo en el lugar donde, Puedes gestionarlo en línea desde el portal del IMSS o asistir al módulo de servicios estudiantiles con tu CURP y comprobante de domicilio.","Puedes realizarlo en el lugar donde, Puedes gestionarlo en línea desde el portal del IMSS o asistir al módulo de servicios estudiantiles con tu CURP y comprobante de domicilio."
¿Puedo autorizar a alguien más a recoger mi historial académico?,tramites,"Sí, mediante carta poder simple firmada por ti, copia de tu identificación y la de quien recoge el documento.","Con respecto a tu pregunta sobre puedo autorizar a alguien más a recoger mi historial académico,, Sí, mediante carta poder simple firmada por ti, copia de tu identificación y la de quien recoge el documento.","Con respecto a tu pregunta sobre puedo autorizar a alguien más a recoger mi historial académico,, Sí, mediante carta poder simple firmada por ti, copia de tu identificación y la de quien recoge el documento."
¿Cómo solicito un duplicado del certificado de bachillerato?,tramites,"Debes acudir a servicios escolares, llenar un formato de solicitud y presentar una copia del certificado original si está disponible.","Para solicito un duplicado del certificado de bachillerato, Debes acudir a servicios escolares, llenar un formato de solicitud y presentar una copia del certificado original si está disponible.","Cómo solicito un duplicado del certificado de bachillerato, Debes acudir a servicios escolares, llenar un formato de solicitud y presentar una copia del certificado original si está disponible."
¿Puedo cancelar un trámite ya solicitado?,tramites,Depende del tipo de trámite. Consulta directamente en servicios escolares lo antes posible para verificar el estado del proceso.,"Con respecto a tu pregunta sobre puedo cancelar un trámite ya solicitado,, Depende del tipo de trámite. Consulta directamente en servicios escolares lo antes posible para verificar el estado del proceso.","Con respecto a tu pregunta sobre puedo cancelar un trámite ya solicitado,, Depende del tipo de trámite. Consulta directamente en servicios escolares lo antes posible para verificar el estado del proceso."
¿Qué pasa si no entrego el proyecto de titulación a tiempo?,requisitos,Deberás reprogramar tu defensa y perderás la fecha asignada. Esto puede retrasar tu proceso de titulación hasta el siguiente periodo.,"Lo que necesitas saber sobre pasa si no entrego el proyecto de titulación a tiempo es, Deberás reprogramar tu defensa y perderás la fecha asignada. Esto puede retrasar tu proceso de titulación hasta el siguiente periodo.","Lo que necesitas saber sobre pasa si no entrego el proyecto de titulación a tiempo es, Deberás reprogramar tu defensa y perderás la fecha asignada. Esto puede retrasar tu proceso de titulación hasta el siguiente periodo."
¿Cuántas horas de prácticas necesito para titularme?,requisitos,Debes completar al menos 240 horas de prácticas profesionales en una empresa avalada por la universidad.,"Con respecto a tu pregunta sobre cuántas horas de prácticas necesito para titularme,, Debes completar al menos 240 horas de prácticas profesionales en una empresa avalada por la universidad.","Con respecto a tu pregunta sobre cuántas horas de prácticas necesito para titularme,, Debes completar al menos 240 horas de prácticas profesionales en una empresa avalada por la universidad."
¿Puedo titularme por experiencia laboral?,requisitos,"Sí, si cuentas con al menos 2 años de experiencia relevante, puedes aplicar para esta modalidad. Debes presentar evidencias y una carta de tu empleador.","Con respecto a tu pregunta sobre puedo titularme por experiencia laboral,, Sí, si cuentas con al menos 2 años de experiencia relevante, puedes aplicar para esta modalidad. Debes presentar evidencias y una carta de tu empleador.","Con respecto a tu pregunta sobre puedo titularme por experiencia laboral,, Sí, si cuentas con al menos 2 años de experiencia relevante, puedes aplicar para esta modalidad. Debes presentar evidencias y una carta de tu empleador."
¿Cuáles son los pasos para titularme por promedio?,requisitos,"Debes tener promedio igual o superior a 4.5, sin materias reprobadas, y completar el curso de inducción a la titulación.","Con respecto a tu pregunta sobre cuáles son los pasos para titularme por promedio,, Debes tener promedio igual o superior a 4.5, sin materias reprobadas, y completar el curso de inducción a la titulación.","Con respecto a tu pregunta sobre cuáles son los pasos para titularme por promedio,, Debes tener promedio igual o superior a 4.5, sin materias reprobadas, y completar el curso de inducción a la titulación."
¿Qué requisitos hay para ingresar a la ceremonia de grado?,requisitos,"Debes haber completado todos los requisitos de titulación, no tener adeudos y confirmar tu asistencia en la oficina de egresados.","Lo que necesitas saber sobre requisitos hay para ingresar a la ceremonia de grado es, Debes haber completado todos los requisitos de titulación, no tener adeudos y confirmar tu asistencia en la oficina de egresados.","Lo que necesitas saber sobre requisitos hay para ingresar a la ceremonia de grado es, Debes haber completado todos los requisitos de titulación, no tener adeudos y confirmar tu asistencia en la oficina de egresados."
¿Dónde puedo ver mi promedio acumulado?,calificaciones,Tu promedio acumulado está disponible en la sección 'Historial académico' del portal estudiantil.,"Puedes hacerlo en el lugar donde, Tu promedio acumulado está disponible en la sección 'Historial académico' del portal estudiantil.","Puedes realizarlo en el lugar donde, Tu promedio acumulado está disponible en la sección 'Historial académico' del portal estudiantil."
¿Qué significa tener una nota en observación?,calificaciones,Significa que la calificación está bajo revisión por parte del docente o el comité académico. Se actualizará cuando se resuelva la observación.,"Lo que necesitas saber sobre significa tener una nota en observación es, Significa que la calificación está bajo revisión por parte del docente o el comité académico. Se actualizará cuando se resuelva la observación.","Lo que necesitas saber sobre significa tener una nota en observación es, Significa que la calificación está bajo revisión por parte del docente o el comité académico. Se actualizará cuando se resuelva la observación."
¿Las calificaciones se pueden apelar?,calificaciones,"Sí, puedes apelar una calificación formalmente dentro de los 3 días hábiles posteriores a su publicación.","Con respecto a tu pregunta sobre las calificaciones se pueden apelar,, Sí, puedes apelar una calificación formalmente dentro de los 3 días hábiles posteriores a su publicación.","Con respecto a tu pregunta sobre las calificaciones se pueden apelar,, Sí, puedes apelar una calificación formalmente dentro de los 3 días hábiles posteriores a su publicación."
¿Qué nota necesito para aprobar una materia con evaluación acumulativa?,calificaciones,"Debes tener al menos 60 puntos sobre 100 entre parciales, talleres y examen final, según los criterios del curso.","Lo que necesitas saber sobre nota necesito para aprobar una materia con evaluación acumulativa es, Debes tener al menos 60 puntos sobre 100 entre parciales, talleres y examen final, según los criterios del curso.","Lo que necesitas saber sobre nota necesito para aprobar una materia con evaluación acumulativa es, Debes tener al menos 60 puntos sobre 100 entre parciales, talleres y examen final, según los criterios del curso."
¿Cómo se ponderan las calificaciones por semestre?,calificaciones,Cada materia tiene un peso según sus créditos. El promedio semestral es el promedio ponderado de esas calificaciones.,"Para se ponderan las calificaciones por semestre, Cada materia tiene un peso según sus créditos. El promedio semestral es el promedio ponderado de esas calificaciones.","Cómo se ponderan las calificaciones por semestre, Cada materia tiene un peso según sus créditos. El promedio semestral es el promedio ponderado de esas calificaciones."
¿Qué significa estar en baja académica?,matriculas,Significa que no cumpliste con el promedio mínimo requerido. Necesitarás autorización especial para reinscribirte el siguiente semestre.,"Lo que necesitas saber sobre significa estar en baja académica es, Significa que no cumpliste con el promedio mínimo requerido. Necesitarás autorización especial para reinscribirte el siguiente semestre.","Lo que necesitas saber sobre significa estar en baja académica es, Significa que no cumpliste con el promedio mínimo requerido. Necesitarás autorización especial para reinscribirte el siguiente semestre."
¿Qué pasa si intento inscribirme fuera del horario establecido?,matriculas,El sistema bloqueará el acceso y deberás esperar al siguiente periodo o solicitar una inscripción extemporánea con justificante.,"Lo que necesitas saber sobre pasa si intento inscribirme fuera del horario establecido es, El sistema bloqueará el acceso y deberás esperar al siguiente periodo o solicitar una inscripción extemporánea con justificante.","Lo que necesitas saber sobre pasa si intento inscribirme fuera del horario establecido es, El sistema bloqueará el acceso y deberás esperar al siguiente periodo o solicitar una inscripción extemporánea con justificante."
¿La reinscripción es automática si pagué a tiempo?,matriculas,"No, debes completar todo el proceso en el portal. El pago solo garantiza acceso al sistema, no la selección de materias.","Con respecto a tu pregunta sobre la reinscripción es automática si pagué a tiempo,, No, debes completar todo el proceso en el portal. El pago solo garantiza acceso al sistema, no la selección de materias.","Con respecto a tu pregunta sobre la reinscripción es automática si pagué a tiempo,, No, debes completar todo el proceso en el portal. El pago solo garantiza acceso al sistema, no la selección de materias."
¿Cuántas veces puedo suspender mis estudios?,matriculas,"Puedes solicitar hasta dos suspensiones académicas durante tu carrera, cada una con duración máxima de un semestre.","Con respecto a tu pregunta sobre cuántas veces puedo suspender mis estudios,, Puedes solicitar hasta dos suspensiones académicas durante tu carrera, cada una con duración máxima de un semestre.","Con respecto a tu pregunta sobre cuántas veces puedo suspender mis estudios,, Puedes solicitar hasta dos suspensiones académicas durante tu carrera, cada una con duración máxima de un semestre."
¿Qué sucede si selecciono más materias de las permitidas?,matriculas,El sistema te impedirá completar la inscripción y mostrará un mensaje de error. Consulta tu coordinador si necesitas sobrecarga académica.,"Lo que necesitas saber sobre sucede si selecciono más materias de las permitidas es, El sistema te impedirá completar la inscripción y mostrará un mensaje de error. Consulta tu coordinador si necesitas sobrecarga académica.","Lo que necesitas saber sobre sucede si selecciono más materias de las permitidas es, El sistema te impedirá completar la inscripción y mostrará un mensaje de error. Consulta tu coordinador si necesitas sobrecarga académica."
¿Qué debo hacer si encuentro una falla en un laboratorio?,instalaciones,Debes reportarla inmediatamente al encargado del laboratorio o al correo de soporte técnico institucional.,"Lo que necesitas saber sobre debo hacer si encuentro una falla en un laboratorio es, Debes reportarla inmediatamente al encargado del laboratorio o al correo de soporte técnico institucional.","Lo que necesitas saber sobre debo hacer si encuentro una falla en un laboratorio es, Debes reportarla inmediatamente al encargado del laboratorio o al correo de soporte técnico institucional."
¿Puedo reservar un salón para reunión de grupo?,instalaciones,"Sí, algunos salones están disponibles para reserva estudiantil fuera del horario de clases. Solicítalo en coordinación académica.","Con respecto a tu pregunta sobre puedo reservar un salón para reunión de grupo,, Sí, algunos salones están disponibles para reserva estudiantil fuera del horario de clases. Solicítalo en coordinación académica.","Con respecto a tu pregunta sobre puedo reservar un salón para reunión de grupo,, Sí, algunos salones están disponibles para reserva estudiantil fuera del horario de clases. Solicítalo en coordinación académica."
¿Dónde encuentro baños adaptados para personas con discapacidad?,instalaciones,Están ubicados en todos los edificios principales y están debidamente señalizados para fácil identificación.,"Puedes hacerlo en el lugar donde, Están ubicados en todos los edificios principales y están debidamente señalizados para fácil identificación.","Puedes realizarlo en el lugar donde, Están ubicados en todos los edificios principales y están debidamente señalizados para fácil identificación."
¿Los salones están ventilados adecuadamente?,instalaciones,"Sí, todos los salones cuentan con ventilación natural o mecánica. Se supervisa el cumplimiento de normas de seguridad sanitaria.","Con respecto a tu pregunta sobre los salones están ventilados adecuadamente,, Sí, todos los salones cuentan con ventilación natural o mecánica. Se supervisa el cumplimiento de normas de seguridad sanitaria.","Con respecto a tu pregunta sobre los salones están ventilados adecuadamente,, Sí, todos los salones cuentan con ventilación natural o mecánica. Se supervisa el cumplimiento de normas de seguridad sanitaria."
¿Puedo tomar materias de diferentes turnos?,horarios,"Sí, siempre que no haya conflictos de horario entre ellas y estén disponibles en la oferta académica.","Con respecto a tu pregunta sobre puedo tomar materias de diferentes turnos,, Sí, siempre que no haya conflictos de horario entre ellas y estén disponibles en la oferta académica.","Con respecto a tu pregunta sobre puedo tomar materias de diferentes turnos,, Sí, siempre que no haya conflictos de horario entre ellas y estén disponibles en la oferta académica."
¿Cuándo se habilita la plataforma para ver horarios?,horarios,"Una semana antes del inicio de inscripciones, el portal publica los horarios en la sección 'Oferta académica'.","El momento indicado para se habilita la plataforma para ver horarios es, Una semana antes del inicio de inscripciones, el portal publica los horarios en la sección 'Oferta académica'.","El momento indicado para se habilita la plataforma para ver horarios es, Una semana antes del inicio de inscripciones, el portal publica los horarios en la sección 'Oferta académica'."
¿Qué hago si mi clase fue cancelada por el profesor?,horarios,Consulta en coordinación académica si se reasignará o si puedes cambiarte de grupo o materia.,"Lo que necesitas saber sobre hago si mi clase fue cancelada por el profesor es, Consulta en coordinación académica si se reasignará o si puedes cambiarte de grupo o materia.","Lo que necesitas saber sobre hago si mi clase fue cancelada por el profesor es, Consulta en coordinación académica si se reasignará o si puedes cambiarte de grupo o materia."
¿Qué horario tienen las clases virtuales?,horarios,Las clases virtuales mantienen el mismo horario que las presenciales. Debes conectarte en el horario asignado en la plataforma.,"Lo que necesitas saber sobre horario tienen las clases virtuales es, Las clases virtuales mantienen el mismo horario que las presenciales. Debes conectarte en el horario asignado en la plataforma.","Lo que necesitas saber sobre horario tienen las clases virtuales es, Las clases virtuales mantienen el mismo horario que las presenciales. Debes conectarte en el horario asignado en la plataforma."
¿El cambio de horario afecta mi beca?,horarios,No afecta siempre que mantengas tu carga académica completa y cumplas con el promedio requerido.,"Con respecto a tu pregunta sobre el cambio de horario afecta mi beca,, No afecta siempre que mantengas tu carga académica completa y cumplas con el promedio requerido.","Con respecto a tu pregunta sobre el cambio de horario afecta mi beca,, No afecta siempre que mantengas tu carga académica completa y cumplas con el promedio requerido."
¿Hay horarios especiales para estudiantes trabajadores?,horarios,"Sí, existen grupos nocturnos o fines de semana. Consulta con tu coordinador para validar tu elegibilidad.","Con respecto a tu pregunta sobre hay horarios especiales para estudiantes trabajadores,, Sí, existen grupos nocturnos o fines de semana. Consulta con tu coordinador para validar tu elegibilidad.","Con respecto a tu pregunta sobre hay horarios especiales para estudiantes trabajadores,, Sí, existen grupos nocturnos o fines de semana. Consulta con tu coordinador para validar tu elegibilidad."
¿Cómo obtengo mi carta de buena conducta?,tramites,Solicítala en servicios escolares con tu identificación. El trámite tarda entre 2 y 3 días hábiles.,"Para obtengo mi carta de buena conducta, Solicítala en servicios escolares con tu identificación. El trámite tarda entre 2 y 3 días hábiles.","Cómo obtengo mi carta de buena conducta, Solicítala en servicios escolares con tu identificación. El trámite tarda entre 2 y 3 días hábiles."
¿Dónde entrego los documentos para mi titulación?,tramites,Debes entregarlos en la oficina de titulación o subirlos al portal institucional según se indique en la convocatoria.,"Puedes hacerlo en el lugar donde, Debes entregarlos en la oficina de titulación o subirlos al portal institucional según se indique en la convocatoria.","Puedes realizarlo en el lugar donde, Debes entregarlos en la oficina de titulación o subirlos al portal institucional según se indique en la convocatoria."
¿Puedo solicitar constancia de estudios en vacaciones?,tramites,"Sí, siempre que la oficina de servicios escolares esté operativa. Verifica los horarios especiales de atención en vacaciones.","Con respecto a tu pregunta sobre puedo solicitar constancia de estudios en vacaciones,, Sí, siempre que la oficina de servicios escolares esté operativa. Verifica los horarios especiales de atención en vacaciones.","Con respecto a tu pregunta sobre puedo solicitar constancia de estudios en vacaciones,, Sí, siempre que la oficina de servicios escolares esté operativa. Verifica los horarios especiales de atención en vacaciones."
¿Cómo tramito una baja definitiva?,tramites,"Solicítala por escrito en servicios escolares, junto con una entrevista con tu tutor académico y el visto bueno de la coordinación.","Para tramito una baja definitiva, Solicítala por escrito en servicios escolares, junto con una entrevista con tu tutor académico y el visto bueno de la coordinación.","Cómo tramito una baja definitiva, Solicítala por escrito en servicios escolares, junto con una entrevista con tu tutor académico y el visto bueno de la coordinación."
¿Qué hago si pierdo mi certificado original?,tramites,"Debes tramitar un duplicado con una carta de pérdida firmada, identificación oficial y comprobante de pago.","Lo que necesitas saber sobre hago si pierdo mi certificado original es, Debes tramitar un duplicado con una carta de pérdida firmada, identificación oficial y comprobante de pago.","Lo que necesitas saber sobre hago si pierdo mi certificado original es, Debes tramitar un duplicado con una carta de pérdida firmada, identificación oficial y comprobante de pago."
¿Cuánto cuesta una constancia académica?,tramites,"Tiene un costo aproximado de $30.000 COP. El valor puede variar, consulta el tarifario institucional actualizado.","El valor relacionado con cuesta una constancia académica es, Tiene un costo aproximado de $30.000 COP. El valor puede variar, consulta el tarifario institucional actualizado.","El valor relacionado con cuesta una constancia académica es, Tiene un costo aproximado de $30.000 COP. El valor puede variar, consulta el tarifario institucional actualizado."
¿Qué pasa si repruebo el examen de titulación?,requisitos,Tendrás una segunda oportunidad en el siguiente periodo. Deberás prepararte con asesoría académica y notificar tu interés por escrito.,"Lo que necesitas saber sobre pasa si repruebo el examen de titulación es, Tendrás una segunda oportunidad en el siguiente periodo. Deberás prepararte con asesoría académica y notificar tu interés por escrito.","Lo que necesitas saber sobre pasa si repruebo el examen de titulación es, Tendrás una segunda oportunidad en el siguiente periodo. Deberás prepararte con asesoría académica y notificar tu interés por escrito."
¿Necesito entregar tesis impresa y digital?,requisitos,"Sí, normalmente se requiere una versión impresa para archivo físico y otra digital en formato PDF para el repositorio institucional.","Lo que necesitas es, Sí, normalmente se requiere una versión impresa para archivo físico y otra digital en formato PDF para el repositorio institucional.","Lo que necesitas es, Sí, normalmente se requiere una versión impresa para archivo físico y otra digital en formato PDF para el repositorio institucional."
¿Cuánto dura el proceso de titulación?,requisitos,"Aproximadamente entre 2 y 4 meses, dependiendo del tipo de modalidad elegida y la validación de documentos.","El valor relacionado con dura el proceso de titulación es, Aproximadamente entre 2 y 4 meses, dependiendo del tipo de modalidad elegida y la validación de documentos.","El valor relacionado con dura el proceso de titulación es, Aproximadamente entre 2 y 4 meses, dependiendo del tipo de modalidad elegida y la validación de documentos."
¿Puedo titularme si tengo una materia en curso?,requisitos,No. Debes haber aprobado todas las materias y estar libre de cualquier asignatura pendiente.,"Con respecto a tu pregunta sobre puedo titularme si tengo una materia en curso,, No. Debes haber aprobado todas las materias y estar libre de cualquier asignatura pendiente.","Con respecto a tu pregunta sobre puedo titularme si tengo una materia en curso,, No. Debes haber aprobado todas las materias y estar libre de cualquier asignatura pendiente."
¿Qué certificación necesito para titularme en idiomas?,requisitos,"Debes contar con una certificación B1 o equivalente en inglés, según el Marco Común Europeo.","Lo que necesitas saber sobre certificación necesito para titularme en idiomas es, Debes contar con una certificación B1 o equivalente en inglés, según el Marco Común Europeo.","Lo que necesitas saber sobre certificación necesito para titularme en idiomas es, Debes contar con una certificación B1 o equivalente en inglés, según el Marco Común Europeo."
¿Qué pasa si no asisto a la ceremonia de titulación?,requisitos,"Tu título no se ve afectado, pero deberás recogerlo posteriormente en la oficina de egresados con cita previa.","Lo que necesitas saber sobre pasa si no asisto a la ceremonia de titulación es, Tu título no se ve afectado, pero deberás recogerlo posteriormente en la oficina de egresados con cita previa.","Lo que necesitas saber sobre pasa si no asisto a la ceremonia de titulación es, Tu título no se ve afectado, pero deberás recogerlo posteriormente en la oficina de egresados con cita previa."
¿Hay requisitos especiales para titulación en línea?,requisitos,"Sí, debes asistir a una sesión virtual de cierre, entregar todos los documentos escaneados y firmar digitalmente el acta de grado.","Con respecto a tu pregunta sobre hay requisitos especiales para titulación en línea,, Sí, debes asistir a una sesión virtual de cierre, entregar todos los documentos escaneados y firmar digitalmente el acta de grado.","Con respecto a tu pregunta sobre hay requisitos especiales para titulación en línea,, Sí, debes asistir a una sesión virtual de cierre, entregar todos los documentos escaneados y firmar digitalmente el acta de grado."
¿Se puede cambiar de modalidad de titulación una vez iniciada?,requisitos,"Sí, pero debes justificar el cambio y obtener aprobación del comité académico. No aplica si ya presentaste la defensa o examen final.","Con respecto a tu pregunta sobre se puede cambiar de modalidad de titulación una vez iniciada,, Sí, pero debes justificar el cambio y obtener aprobación del comité académico. No aplica si ya presentaste la defensa o examen final.","Con respecto a tu pregunta sobre se puede cambiar de modalidad de titulación una vez iniciada,, Sí, pero debes justificar el cambio y obtener aprobación del comité académico. No aplica si ya presentaste la defensa o examen final."
