consulta,categoria,respuesta,respuesta_compuesta,respuestas_compuestas
¿Cuándo debo solicitar la constancia de prácticas profesionales?,tramites,"Antes de iniciar tus prácticas, solicita la constancia en tu facultad. Debes presentar tu carta de aceptación de la empresa.","El momento indicado para debo solicitar la constancia de prácticas profesionales es, Antes de iniciar tus prácticas, solicita la constancia en tu facultad. Debes presentar tu carta de aceptación de la empresa.","El momento indicado para debo solicitar la constancia de prácticas profesionales es, Antes de iniciar tus prácticas, solicita la constancia en tu facultad. Debes presentar tu carta de aceptación de la empresa."
¿Dónde puedo solicitar una carta de presentación institucional?,tramites,Puedes solicitarla en coordinación académica. Debes indicar el propósito y destinatario de la carta.,"Puedes hacerlo en el lugar donde, Puedes solicitarla en coordinación académica. Debes indicar el propósito y destinatario de la carta.","Puedes realizarlo en el lugar donde, Puedes solicitarla en coordinación académica. Debes indicar el propósito y destinatario de la carta."
¿Qué documentos necesito para tramitar mi título profesional?,tramites,"Debes presentar: acta de grado, certificado de notas, cédula, recibo de pago y formato de solicitud de título.","Lo que necesitas saber sobre documentos necesito para tramitar mi título profesional es, Debes presentar: acta de grado, certificado de notas, cédula, recibo de pago y formato de solicitud de título.","Lo que necesitas saber sobre documentos necesito para tramitar mi título profesional es, Debes presentar: acta de grado, certificado de notas, cédula, recibo de pago y formato de solicitud de título."
¿Cuánto tarda la entrega de una constancia de inscripción?,tramites,Generalmente entre 24 y 48 horas hábiles. Puedes consultarlo en la ventanilla de servicios escolares.,"El valor relacionado con tarda la entrega de una constancia de inscripción es, Generalmente entre 24 y 48 horas hábiles. Puedes consultarlo en la ventanilla de servicios escolares.","El valor relacionado con tarda la entrega de una constancia de inscripción es, Generalmente entre 24 y 48 horas hábiles. Puedes consultarlo en la ventanilla de servicios escolares."
¿Puedo tramitar mi certificado de notas digitalmente?,tramites,"Sí, algunos certificados están disponibles en el portal institucional. Requiere autenticación con usuario y contraseña.","Con respecto a tu pregunta sobre puedo tramitar mi certificado de notas digitalmente,, Sí, algunos certificados están disponibles en el portal institucional. Requiere autenticación con usuario y contraseña.","Con respecto a tu pregunta sobre puedo tramitar mi certificado de notas digitalmente,, Sí, algunos certificados están disponibles en el portal institucional. Requiere autenticación con usuario y contraseña."
¿Qué hacer si mis datos personales aparecen incorrectos en un certificado?,tramites,Debes reportarlo a servicios escolares y presentar documento válido que justifique la corrección.,"Lo que necesitas saber sobre hacer si mis datos personales aparecen incorrectos en un certificado es, Debes reportarlo a servicios escolares y presentar documento válido que justifique la corrección.","Lo que necesitas saber sobre hacer si mis datos personales aparecen incorrectos en un certificado es, Debes reportarlo a servicios escolares y presentar documento válido que justifique la corrección."
¿Puedo tramitar mi certificado de egreso si no he recibido el título?,tramites,"Sí, puedes solicitar un certificado provisional de egreso mientras se tramita tu título oficial.","Con respecto a tu pregunta sobre puedo tramitar mi certificado de egreso si no he recibido el título,, Sí, puedes solicitar un certificado provisional de egreso mientras se tramita tu título oficial.","Con respecto a tu pregunta sobre puedo tramitar mi certificado de egreso si no he recibido el título,, Sí, puedes solicitar un certificado provisional de egreso mientras se tramita tu título oficial."
¿Qué hacer si extravío mi acta de grado?,tramites,Solicita un duplicado en coordinación académica. Deberás pagar un valor administrativo y presentar identificación oficial.,"Lo que necesitas saber sobre hacer si extravío mi acta de grado es, Solicita un duplicado en coordinación académica. Deberás pagar un valor administrativo y presentar identificación oficial.","Lo que necesitas saber sobre hacer si extravío mi acta de grado es, Solicita un duplicado en coordinación académica. Deberás pagar un valor administrativo y presentar identificación oficial."
¿Cómo puedo recibir mis documentos si vivo en otra ciudad?,tramites,Puedes solicitar envío certificado a tu domicilio. Verifica disponibilidad y costos con servicios escolares.,"Para puedo recibir mis documentos si vivo en otra ciudad, Puedes solicitar envío certificado a tu domicilio. Verifica disponibilidad y costos con servicios escolares.","Para recibir mis documentos si vivo en otra ciudad, Puedes solicitar envío certificado a tu domicilio. Verifica disponibilidad y costos con servicios escolares."
¿Cuál es el costo promedio de un trámite académico?,tramites,Varía según el documento. Puedes consultar el tarifario actualizado en el portal institucional o en caja.,"La el costo promedio de un trámite académico es, Varía según el documento. Puedes consultar el tarifario actualizado en el portal institucional o en caja.","La el costo promedio de un trámite académico es, Varía según el documento. Puedes consultar el tarifario actualizado en el portal institucional o en caja."
¿Hay espacios disponibles para hacer presentaciones estudiantiles?,instalaciones,"Sí, puedes reservar auditorios o salas multimedia con anticipación en coordinación académica.","Con respecto a tu pregunta sobre hay espacios disponibles para hacer presentaciones estudiantiles,, Sí, puedes reservar auditorios o salas multimedia con anticipación en coordinación académica.","Con respecto a tu pregunta sobre hay espacios disponibles para hacer presentaciones estudiantiles,, Sí, puedes reservar auditorios o salas multimedia con anticipación en coordinación académica."
¿Qué servicios ofrece la biblioteca además del préstamo de libros?,instalaciones,"Incluye salas de estudio, bases de datos digitales, asesoría bibliográfica y préstamo de equipos.","Lo que necesitas saber sobre servicios ofrece la biblioteca además del préstamo de libros es, Incluye salas de estudio, bases de datos digitales, asesoría bibliográfica y préstamo de equipos.","Lo que necesitas saber sobre servicios ofrece la biblioteca además del préstamo de libros es, Incluye salas de estudio, bases de datos digitales, asesoría bibliográfica y préstamo de equipos."
¿Se necesita autorización para usar los proyectores de las aulas?,instalaciones,"Sí, aunque los proyectores están instalados en la mayoría de las aulas, su uso requiere coordinación previa con el docente responsable o con el área de soporte técnico.","Con respecto a tu pregunta sobre se necesita autorización para usar los proyectores de las aulas,, Sí, aunque los proyectores están instalados en la mayoría de las aulas, su uso requiere coordinación previa con el docente responsable o con el área de soporte técnico.","Con respecto a tu pregunta sobre se necesita autorización para usar los proyectores de las aulas,, Sí, aunque los proyectores están instalados en la mayoría de las aulas, su uso requiere coordinación previa con el docente responsable o con el área de soporte técnico."
¿Dónde están ubicados los salones de dibujo técnico?,instalaciones,"Están en el bloque C, segundo piso. Puedes consultarlo también en el plano del campus.","Puedes hacerlo en el lugar donde, Están en el bloque C, segundo piso. Puedes consultarlo también en el plano del campus.","Puedes realizarlo en el lugar donde, Están en el bloque C, segundo piso. Puedes consultarlo también en el plano del campus."
¿Hay espacios para actividades artísticas?,instalaciones,"Sí, existe una sala cultural disponible para música, teatro y talleres artísticos previa reserva.","Con respecto a tu pregunta sobre hay espacios para actividades artísticas,, Sí, existe una sala cultural disponible para música, teatro y talleres artísticos previa reserva.","Con respecto a tu pregunta sobre hay espacios para actividades artísticas,, Sí, existe una sala cultural disponible para música, teatro y talleres artísticos previa reserva."
¿Se puede usar el comedor universitario sin clase ese día?,instalaciones,"Sí, siempre que tengas credencial vigente. El servicio está disponible a todos los estudiantes.","Con respecto a tu pregunta sobre se puede usar el comedor universitario sin clase ese día,, Sí, siempre que tengas credencial vigente. El servicio está disponible a todos los estudiantes.","Con respecto a tu pregunta sobre se puede usar el comedor universitario sin clase ese día,, Sí, siempre que tengas credencial vigente. El servicio está disponible a todos los estudiantes."
¿Qué hago si una puerta está cerrada durante mi clase?,instalaciones,Solicita apoyo en vigilancia o en servicios generales. Verificarán la programación del salón.,"Lo que necesitas saber sobre hago si una puerta está cerrada durante mi clase es, Solicita apoyo en vigilancia o en servicios generales. Verificarán la programación del salón.","Lo que necesitas saber sobre hago si una puerta está cerrada durante mi clase es, Solicita apoyo en vigilancia o en servicios generales. Verificarán la programación del salón."
¿Las instalaciones están adaptadas para personas con movilidad reducida?,instalaciones,"Sí, contamos con rampas, ascensores y baños adaptados en todos los edificios principales.","Con respecto a tu pregunta sobre las instalaciones están adaptadas para personas con movilidad reducida,, Sí, contamos con rampas, ascensores y baños adaptados en todos los edificios principales.","Con respecto a tu pregunta sobre las instalaciones están adaptadas para personas con movilidad reducida,, Sí, contamos con rampas, ascensores y baños adaptados en todos los edificios principales."
¿Dónde puedo cargar mis dispositivos móviles?,instalaciones,"Hay estaciones de carga en la biblioteca, cafetería y algunos pasillos centrales del campus.","Puedes hacerlo en el lugar donde, Hay estaciones de carga en la biblioteca, cafetería y algunos pasillos centrales del campus.","Puedes realizarlo en el lugar donde, Hay estaciones de carga en la biblioteca, cafetería y algunos pasillos centrales del campus."
¿Puedo utilizar la sala de audiovisuales fuera del horario de clases?,instalaciones,"Sí, con autorización previa del responsable de la sala y reserva anticipada por correo o formulario.","Con respecto a tu pregunta sobre puedo utilizar la sala de audiovisuales fuera del horario de clases,, Sí, con autorización previa del responsable de la sala y reserva anticipada por correo o formulario.","Con respecto a tu pregunta sobre puedo utilizar la sala de audiovisuales fuera del horario de clases,, Sí, con autorización previa del responsable de la sala y reserva anticipada por correo o formulario."
¿Qué documento necesito para acreditar mi identidad al ingresar?,requisitos,"Debes presentar una identificación oficial vigente como cédula, pasaporte o licencia de conducción.","Lo que necesitas saber sobre documento necesito para acreditar mi identidad al ingresar es, Debes presentar una identificación oficial vigente como cédula, pasaporte o licencia de conducción.","Lo que necesitas saber sobre documento necesito para acreditar mi identidad al ingresar es, Debes presentar una identificación oficial vigente como cédula, pasaporte o licencia de conducción."
¿Puedo presentar un certificado de notas como requisito de ingreso?,requisitos,"Sí, el certificado de notas del nivel anterior es un requisito indispensable para el proceso de admisión.","Con respecto a tu pregunta sobre puedo presentar un certificado de notas como requisito de ingreso,, Sí, el certificado de notas del nivel anterior es un requisito indispensable para el proceso de admisión.","Con respecto a tu pregunta sobre puedo presentar un certificado de notas como requisito de ingreso,, Sí, el certificado de notas del nivel anterior es un requisito indispensable para el proceso de admisión."
¿Es obligatorio presentar una foto tamaño carnet para la inscripción?,requisitos,"Sí, debes entregar una foto reciente tamaño carnet como parte de los requisitos de matrícula.","Con respecto a tu pregunta sobre es obligatorio presentar una foto tamaño carnet para la inscripción,, Sí, debes entregar una foto reciente tamaño carnet como parte de los requisitos de matrícula.","Con respecto a tu pregunta sobre es obligatorio presentar una foto tamaño carnet para la inscripción,, Sí, debes entregar una foto reciente tamaño carnet como parte de los requisitos de matrícula."
¿Se puede inscribir con el acta de grado provisional?,requisitos,"Sí, pero debes presentar el diploma oficial antes del segundo semestre para mantener tu estatus académico.","Con respecto a tu pregunta sobre se puede inscribir con el acta de grado provisional,, Sí, pero debes presentar el diploma oficial antes del segundo semestre para mantener tu estatus académico.","Con respecto a tu pregunta sobre se puede inscribir con el acta de grado provisional,, Sí, pero debes presentar el diploma oficial antes del segundo semestre para mantener tu estatus académico."
¿Qué sucede si me falta un requisito para la inscripción?,requisitos,No podrás finalizar tu inscripción. Debes entregar todos los requisitos para completar el proceso.,"Lo que necesitas saber sobre sucede si me falta un requisito para la inscripción es, No podrás finalizar tu inscripción. Debes entregar todos los requisitos para completar el proceso.","Lo que necesitas saber sobre sucede si me falta un requisito para la inscripción es, No podrás finalizar tu inscripción. Debes entregar todos los requisitos para completar el proceso."
¿Cómo consulto mis calificaciones del semestre?,calificaciones,"Puedes revisar tus calificaciones en el portal estudiantil, sección 'Historial académico'.","Para consulto mis calificaciones del semestre, Puedes revisar tus calificaciones en el portal estudiantil, sección 'Historial académico'.","Cómo consulto mis calificaciones del semestre, Puedes revisar tus calificaciones en el portal estudiantil, sección 'Historial académico'."
¿Qué hacer si una calificación no aparece en el sistema?,calificaciones,Debes comunicarte con el docente responsable y notificar a la coordinación académica para su revisión.,"Lo que necesitas saber sobre hacer si una calificación no aparece en el sistema es, Debes comunicarte con el docente responsable y notificar a la coordinación académica para su revisión.","Lo que necesitas saber sobre hacer si una calificación no aparece en el sistema es, Debes comunicarte con el docente responsable y notificar a la coordinación académica para su revisión."
¿Cómo es el procedimiento para pedir revisión de una nota final?,calificaciones,Debes llenar un formulario oficial y entregarlo en coordinación académica dentro de los 5 días hábiles siguientes a la publicación de la nota.,"Para es el procedimiento para pedir revisión de una nota final, Debes llenar un formulario oficial y entregarlo en coordinación académica dentro de los 5 días hábiles siguientes a la publicación de la nota.","Cómo es el procedimiento para pedir revisión de una nota final, Debes llenar un formulario oficial y entregarlo en coordinación académica dentro de los 5 días hábiles siguientes a la publicación de la nota."
¿Existe algún recurso académico para cuestionar una calificación?,calificaciones,"Sí, puedes presentar una apelación formal ante el comité académico con evidencia de tu solicitud.","Con respecto a tu pregunta sobre existe algún recurso académico para cuestionar una calificación,, Sí, puedes presentar una apelación formal ante el comité académico con evidencia de tu solicitud.","Con respecto a tu pregunta sobre existe algún recurso académico para cuestionar una calificación,, Sí, puedes presentar una apelación formal ante el comité académico con evidencia de tu solicitud."
¿Cuál es el promedio mínimo para mantener una beca?,calificaciones,Debes mantener un promedio acumulado mínimo de 4.0 para conservar tu beca académica.,"La el promedio mínimo para mantener una beca es, Debes mantener un promedio acumulado mínimo de 4.0 para conservar tu beca académica.","La el promedio mínimo para mantener una beca es, Debes mantener un promedio acumulado mínimo de 4.0 para conservar tu beca académica."
¿Qué certificado médico necesito para inscribirme en actividades deportivas?,requisitos,Debes presentar un certificado de aptitud física emitido por un profesional de la salud.,"Lo que necesitas saber sobre certificado médico necesito para inscribirme en actividades deportivas es, Debes presentar un certificado de aptitud física emitido por un profesional de la salud.","Lo que necesitas saber sobre certificado médico necesito para inscribirme en actividades deportivas es, Debes presentar un certificado de aptitud física emitido por un profesional de la salud."
¿Es necesario presentar el certificado de afiliación a salud para la inscripción?,requisitos,"Sí, es obligatorio contar con seguro médico vigente para completar tu inscripción.","Con respecto a tu pregunta sobre es necesario presentar el certificado de afiliación a salud para la inscripción,, Sí, es obligatorio contar con seguro médico vigente para completar tu inscripción.","Con respecto a tu pregunta sobre es necesario presentar el certificado de afiliación a salud para la inscripción,, Sí, es obligatorio contar con seguro médico vigente para completar tu inscripción."
¿Se aceptan fotocopias de documentos como requisitos?,requisitos,Generalmente se requieren originales para verificación. Consulta si puedes presentar copias autenticadas.,"Con respecto a tu pregunta sobre se aceptan fotocopias de documentos como requisitos,, Generalmente se requieren originales para verificación. Consulta si puedes presentar copias autenticadas.","Con respecto a tu pregunta sobre se aceptan fotocopias de documentos como requisitos,, Generalmente se requieren originales para verificación. Consulta si puedes presentar copias autenticadas."
¿Cuántas fotos tamaño carnet debo entregar?,requisitos,"Debes entregar 4 fotos recientes tamaño carnet, en fondo blanco y sin accesorios.","Con respecto a tu pregunta sobre cuántas fotos tamaño carnet debo entregar,, Debes entregar 4 fotos recientes tamaño carnet, en fondo blanco y sin accesorios.","Con respecto a tu pregunta sobre cuántas fotos tamaño carnet debo entregar,, Debes entregar 4 fotos recientes tamaño carnet, en fondo blanco y sin accesorios."
¿Puedo inscribirme con pasaporte si soy extranjero?,requisitos,"Sí, el pasaporte vigente es un documento válido de identificación para estudiantes internacionales.","Con respecto a tu pregunta sobre puedo inscribirme con pasaporte si soy extranjero,, Sí, el pasaporte vigente es un documento válido de identificación para estudiantes internacionales.","Con respecto a tu pregunta sobre puedo inscribirme con pasaporte si soy extranjero,, Sí, el pasaporte vigente es un documento válido de identificación para estudiantes internacionales."
¿Cuándo se publican las calificaciones finales?,calificaciones,Se publican al finalizar el periodo de exámenes. Puedes consultarlas en el portal estudiantil.,"El momento indicado para se publican las calificaciones finales es, Se publican al finalizar el periodo de exámenes. Puedes consultarlas en el portal estudiantil.","El momento indicado para se publican las calificaciones finales es, Se publican al finalizar el periodo de exámenes. Puedes consultarlas en el portal estudiantil."
¿Cómo calcular mi promedio acumulado?,calificaciones,Suma el total de notas ponderadas y divídelo entre el número total de créditos cursados.,"Para calcular mi promedio acumulado, Suma el total de notas ponderadas y divídelo entre el número total de créditos cursados.","Cómo calcular mi promedio acumulado, Suma el total de notas ponderadas y divídelo entre el número total de créditos cursados."
¿Qué nota se requiere para aprobar una materia teórica?,calificaciones,Debes obtener una calificación mínima de 3.0 sobre 5.0 para aprobar.,"Lo que necesitas saber sobre nota se requiere para aprobar una materia teórica es, Debes obtener una calificación mínima de 3.0 sobre 5.0 para aprobar.","Lo que necesitas saber sobre nota se requiere para aprobar una materia teórica es, Debes obtener una calificación mínima de 3.0 sobre 5.0 para aprobar."
¿Qué significa tener una nota de 2.9 en una asignatura?,calificaciones,Significa que no alcanzaste el puntaje mínimo para aprobar. Deberás repetir o presentar recuperación si aplica.,"Lo que necesitas saber sobre significa tener una nota de 2.9 en una asignatura es, Significa que no alcanzaste el puntaje mínimo para aprobar. Deberás repetir o presentar recuperación si aplica.","Lo que necesitas saber sobre significa tener una nota de 2.9 en una asignatura es, Significa que no alcanzaste el puntaje mínimo para aprobar. Deberás repetir o presentar recuperación si aplica."
¿Cuál es el rango de calificación en el sistema universitario?,calificaciones,"Generalmente de 0.0 a 5.0, siendo 3.0 la nota mínima aprobatoria. Consulta el reglamento académico para tu institución.","La el rango de calificación en el sistema universitario es, Generalmente de 0.0 a 5.0, siendo 3.0 la nota mínima aprobatoria. Consulta el reglamento académico para tu institución.","La el rango de calificación en el sistema universitario es, Generalmente de 0.0 a 5.0, siendo 3.0 la nota mínima aprobatoria. Consulta el reglamento académico para tu institución."
¿Cómo puedo tramitar mi carné universitario por primera vez?,tramites,Debes solicitarlo en servicios escolares presentando tu comprobante de inscripción y una fotografía reciente.,"Para puedo tramitar mi carné universitario por primera vez, Debes solicitarlo en servicios escolares presentando tu comprobante de inscripción y una fotografía reciente.","Para tramitar mi carné universitario por primera vez, Debes solicitarlo en servicios escolares presentando tu comprobante de inscripción y una fotografía reciente."
¿Qué requisitos hay para pedir constancia de estudios para visa?,tramites,"Debes presentar tu pasaporte, comprobante de inscripción y carta de solicitud firmada.","Lo que necesitas saber sobre requisitos hay para pedir constancia de estudios para visa es, Debes presentar tu pasaporte, comprobante de inscripción y carta de solicitud firmada.","Lo que necesitas saber sobre requisitos hay para pedir constancia de estudios para visa es, Debes presentar tu pasaporte, comprobante de inscripción y carta de solicitud firmada."
¿Puedo gestionar mis trámites académicos en línea?,tramites,"Sí, muchos trámites como constancias y certificados pueden gestionarse desde el portal estudiantil.","Con respecto a tu pregunta sobre puedo gestionar mis trámites académicos en línea,, Sí, muchos trámites como constancias y certificados pueden gestionarse desde el portal estudiantil.","Con respecto a tu pregunta sobre puedo gestionar mis trámites académicos en línea,, Sí, muchos trámites como constancias y certificados pueden gestionarse desde el portal estudiantil."
¿Qué hacer si no aparece mi certificado de notas en el sistema?,tramites,Contacta al área de servicios escolares y verifica si hay un retraso o falta algún documento.,"Lo que necesitas saber sobre hacer si no aparece mi certificado de notas en el sistema es, Contacta al área de servicios escolares y verifica si hay un retraso o falta algún documento.","Lo que necesitas saber sobre hacer si no aparece mi certificado de notas en el sistema es, Contacta al área de servicios escolares y verifica si hay un retraso o falta algún documento."
¿Dónde actualizo mis datos personales institucionales?,tramites,Debes ingresar al portal estudiantil o acudir personalmente a servicios escolares con tu documento de identidad.,"Puedes hacerlo en el lugar donde, Debes ingresar al portal estudiantil o acudir personalmente a servicios escolares con tu documento de identidad.","Puedes realizarlo en el lugar donde, Debes ingresar al portal estudiantil o acudir personalmente a servicios escolares con tu documento de identidad."
¿Cómo se realiza el trámite administrativo para solicitar una doble titulación?,tramites,"Debes presentar carta de motivos, historial académico, y obtener autorización de ambos programas académicos.","Para se realiza el trámite administrativo para solicitar una doble titulación, Debes presentar carta de motivos, historial académico, y obtener autorización de ambos programas académicos.","Cómo se realiza el trámite administrativo para solicitar una doble titulación, Debes presentar carta de motivos, historial académico, y obtener autorización de ambos programas académicos."
