consulta,categoria,respuesta,respuestas_compuestas,consulta_
¿Qué condiciones aplican para ingresar al campus los fines de semana?,instalaciones,"El ingreso durante los fines de semana está permitido solo si tienes clases programadas, eventos oficiales o una autorización previa expedida por coordinación académica.","¿Qué condiciones aplican para ingresar al campus los fines de semana? El ingreso durante los fines de semana está permitido solo si tienes clases programadas, eventos oficiales o una autorización previa expedida por coordinación académica.",¿Qué condiciones aplican para ingresar al campus los fines de semana? instalaciones
¿Las aulas cuentan con conexión a internet?,instalaciones,"Sí, todas las aulas principales tienen acceso a la red Wi-Fi institucional.","¿Las aulas cuentan con conexión a internet? Sí, todas las aulas principales tienen acceso a la red Wi-Fi institucional.",¿Las aulas cuentan con conexión a internet? instalaciones
¿Qué espacios hay para descansar entre clases?,instalaciones,"Hay zonas verdes, bancas techadas y salones de descanso en varios bloques del campus.","¿Qué espacios hay para descansar entre clases? Hay zonas verdes, bancas techadas y salones de descanso en varios bloques del campus.",¿Qué espacios hay para descansar entre clases? instalaciones
¿Quién supervisa el uso de los laboratorios?,instalaciones,"Cada laboratorio cuenta con un encargado responsable del equipo, seguridad y cumplimiento de normas.","¿Quién supervisa el uso de los laboratorios? Cada laboratorio cuenta con un encargado responsable del equipo, seguridad y cumplimiento de normas.",¿Quién supervisa el uso de los laboratorios? instalaciones
¿Dónde se puede recargar el carné para servicios internos?,instalaciones,En las máquinas de autoservicio ubicadas en la biblioteca o en el módulo financiero del campus.,¿Dónde se puede recargar el carné para servicios internos? En las máquinas de autoservicio ubicadas en la biblioteca o en el módulo financiero del campus.,¿Dónde se puede recargar el carné para servicios internos? instalaciones
¿Cuándo debo solicitar la constancia de prácticas profesionales?,tramites,"Antes de iniciar tus prácticas, solicita la constancia en tu facultad. Debes presentar tu carta de aceptación de la empresa.","¿Cuándo debo solicitar la constancia de prácticas profesionales? Antes de iniciar tus prácticas, solicita la constancia en tu facultad. Debes presentar tu carta de aceptación de la empresa.",¿Cuándo debo solicitar la constancia de prácticas profesionales? tramites
¿Dónde puedo solicitar una carta de presentación institucional?,tramites,Puedes solicitarla en coordinación académica. Debes indicar el propósito y destinatario de la carta.,¿Dónde puedo solicitar una carta de presentación institucional? Puedes solicitarla en coordinación académica. Debes indicar el propósito y destinatario de la carta.,¿Dónde puedo solicitar una carta de presentación institucional? tramites
¿Qué documentos necesito para tramitar mi título profesional?,tramites,"Debes presentar: acta de grado, certificado de notas, cédula, recibo de pago y formato de solicitud de título.","¿Qué documentos necesito para tramitar mi título profesional? Debes presentar: acta de grado, certificado de notas, cédula, recibo de pago y formato de solicitud de título.",¿Qué documentos necesito para tramitar mi título profesional? tramites
¿Cuánto tarda la entrega de una constancia de inscripción?,tramites,Generalmente entre 24 y 48 horas hábiles. Puedes consultarlo en la ventanilla de servicios escolares.,¿Cuánto tarda la entrega de una constancia de inscripción? Generalmente entre 24 y 48 horas hábiles. Puedes consultarlo en la ventanilla de servicios escolares.,¿Cuánto tarda la entrega de una constancia de inscripción? tramites
¿Puedo tramitar mi certificado de notas digitalmente?,tramites,"Sí, algunos certificados están disponibles en el portal institucional. Requiere autenticación con usuario y contraseña.","¿Puedo tramitar mi certificado de notas digitalmente? Sí, algunos certificados están disponibles en el portal institucional. Requiere autenticación con usuario y contraseña.",¿Puedo tramitar mi certificado de notas digitalmente? tramites
¿Qué hacer si mis datos personales aparecen incorrectos en un certificado?,tramites,Debes reportarlo a servicios escolares y presentar documento válido que justifique la corrección.,¿Qué hacer si mis datos personales aparecen incorrectos en un certificado? Debes reportarlo a servicios escolares y presentar documento válido que justifique la corrección.,¿Qué hacer si mis datos personales aparecen incorrectos en un certificado? tramites
¿Puedo tramitar mi certificado de egreso si no he recibido el título?,tramites,"Sí, puedes solicitar un certificado provisional de egreso mientras se tramita tu título oficial.","¿Puedo tramitar mi certificado de egreso si no he recibido el título? Sí, puedes solicitar un certificado provisional de egreso mientras se tramita tu título oficial.",¿Puedo tramitar mi certificado de egreso si no he recibido el título? tramites
¿Qué hacer si extravío mi acta de grado?,tramites,Solicita un duplicado en coordinación académica. Deberás pagar un valor administrativo y presentar identificación oficial.,¿Qué hacer si extravío mi acta de grado? Solicita un duplicado en coordinación académica. Deberás pagar un valor administrativo y presentar identificación oficial.,¿Qué hacer si extravío mi acta de grado? tramites
¿Cómo puedo recibir mis documentos si vivo en otra ciudad?,tramites,Puedes solicitar envío certificado a tu domicilio. Verifica disponibilidad y costos con servicios escolares.,¿Cómo puedo recibir mis documentos si vivo en otra ciudad? Puedes solicitar envío certificado a tu domicilio. Verifica disponibilidad y costos con servicios escolares.,¿Cómo puedo recibir mis documentos si vivo en otra ciudad? tramites
¿Cuál es el costo promedio de un trámite académico?,tramites,Varía según el documento. Puedes consultar el tarifario actualizado en el portal institucional o en caja.,¿Cuál es el costo promedio de un trámite académico? Varía según el documento. Puedes consultar el tarifario actualizado en el portal institucional o en caja.,¿Cuál es el costo promedio de un trámite académico? tramites
¿Hay espacios disponibles para hacer presentaciones estudiantiles?,instalaciones,"Sí, puedes reservar auditorios o salas multimedia con anticipación en coordinación académica.","¿Hay espacios disponibles para hacer presentaciones estudiantiles? Sí, puedes reservar auditorios o salas multimedia con anticipación en coordinación académica.",¿Hay espacios disponibles para hacer presentaciones estudiantiles? instalaciones
¿Qué servicios ofrece la biblioteca además del préstamo de libros?,instalaciones,"Incluye salas de estudio, bases de datos digitales, asesoría bibliográfica y préstamo de equipos.","¿Qué servicios ofrece la biblioteca además del préstamo de libros? Incluye salas de estudio, bases de datos digitales, asesoría bibliográfica y préstamo de equipos.",¿Qué servicios ofrece la biblioteca además del préstamo de libros? instalaciones
¿Se necesita autorización para usar los proyectores de las aulas?,instalaciones,"Sí, aunque los proyectores están instalados en la mayoría de las aulas, su uso requiere coordinación previa con el docente responsable o con el área de soporte técnico.","¿Se necesita autorización para usar los proyectores de las aulas? Sí, aunque los proyectores están instalados en la mayoría de las aulas, su uso requiere coordinación previa con el docente responsable o con el área de soporte técnico.",¿Se necesita autorización para usar los proyectores de las aulas? instalaciones
¿Dónde están ubicados los salones de dibujo técnico?,instalaciones,"Están en el bloque C, segundo piso. Puedes consultarlo también en el plano del campus.","¿Dónde están ubicados los salones de dibujo técnico? Están en el bloque C, segundo piso. Puedes consultarlo también en el plano del campus.",¿Dónde están ubicados los salones de dibujo técnico? instalaciones
¿Hay espacios para actividades artísticas?,instalaciones,"Sí, existe una sala cultural disponible para música, teatro y talleres artísticos previa reserva.","¿Hay espacios para actividades artísticas? Sí, existe una sala cultural disponible para música, teatro y talleres artísticos previa reserva.",¿Hay espacios para actividades artísticas? instalaciones
¿Se puede usar el comedor universitario sin clase ese día?,instalaciones,"Sí, siempre que tengas credencial vigente. El servicio está disponible a todos los estudiantes.","¿Se puede usar el comedor universitario sin clase ese día? Sí, siempre que tengas credencial vigente. El servicio está disponible a todos los estudiantes.",¿Se puede usar el comedor universitario sin clase ese día? instalaciones
¿Qué hago si una puerta está cerrada durante mi clase?,instalaciones,Solicita apoyo en vigilancia o en servicios generales. Verificarán la programación del salón.,¿Qué hago si una puerta está cerrada durante mi clase? Solicita apoyo en vigilancia o en servicios generales. Verificarán la programación del salón.,¿Qué hago si una puerta está cerrada durante mi clase? instalaciones
¿Las instalaciones están adaptadas para personas con movilidad reducida?,instalaciones,"Sí, contamos con rampas, ascensores y baños adaptados en todos los edificios principales.","¿Las instalaciones están adaptadas para personas con movilidad reducida? Sí, contamos con rampas, ascensores y baños adaptados en todos los edificios principales.",¿Las instalaciones están adaptadas para personas con movilidad reducida? instalaciones
¿Dónde puedo cargar mis dispositivos móviles?,instalaciones,"Hay estaciones de carga en la biblioteca, cafetería y algunos pasillos centrales del campus.","¿Dónde puedo cargar mis dispositivos móviles? Hay estaciones de carga en la biblioteca, cafetería y algunos pasillos centrales del campus.",¿Dónde puedo cargar mis dispositivos móviles? instalaciones
¿Puedo utilizar la sala de audiovisuales fuera del horario de clases?,instalaciones,"Sí, con autorización previa del responsable de la sala y reserva anticipada por correo o formulario.","¿Puedo utilizar la sala de audiovisuales fuera del horario de clases? Sí, con autorización previa del responsable de la sala y reserva anticipada por correo o formulario.",¿Puedo utilizar la sala de audiovisuales fuera del horario de clases? instalaciones
¿Qué documento necesito para acreditar mi identidad al ingresar?,requisitos,"Debes presentar una identificación oficial vigente como cédula, pasaporte o licencia de conducción.","¿Qué documento necesito para acreditar mi identidad al ingresar? Debes presentar una identificación oficial vigente como cédula, pasaporte o licencia de conducción.",¿Qué documento necesito para acreditar mi identidad al ingresar? requisitos
¿Puedo presentar un certificado de notas como requisito de ingreso?,requisitos,"Sí, el certificado de notas del nivel anterior es un requisito indispensable para el proceso de admisión.","¿Puedo presentar un certificado de notas como requisito de ingreso? Sí, el certificado de notas del nivel anterior es un requisito indispensable para el proceso de admisión.",¿Puedo presentar un certificado de notas como requisito de ingreso? requisitos
¿Es obligatorio presentar una foto tamaño carnet para la inscripción?,requisitos,"Sí, debes entregar una foto reciente tamaño carnet como parte de los requisitos de matrícula.","¿Es obligatorio presentar una foto tamaño carnet para la inscripción? Sí, debes entregar una foto reciente tamaño carnet como parte de los requisitos de matrícula.",¿Es obligatorio presentar una foto tamaño carnet para la inscripción? requisitos
¿Se puede inscribir con el acta de grado provisional?,requisitos,"Sí, pero debes presentar el diploma oficial antes del segundo semestre para mantener tu estatus académico.","¿Se puede inscribir con el acta de grado provisional? Sí, pero debes presentar el diploma oficial antes del segundo semestre para mantener tu estatus académico.",¿Se puede inscribir con el acta de grado provisional? requisitos
¿Qué sucede si me falta un requisito para la inscripción?,requisitos,No podrás finalizar tu inscripción. Debes entregar todos los requisitos para completar el proceso.,¿Qué sucede si me falta un requisito para la inscripción? No podrás finalizar tu inscripción. Debes entregar todos los requisitos para completar el proceso.,¿Qué sucede si me falta un requisito para la inscripción? requisitos
¿Cómo consulto mis calificaciones del semestre?,calificaciones,"Puedes revisar tus calificaciones en el portal estudiantil, sección 'Historial académico'.","¿Cómo consulto mis calificaciones del semestre? Puedes revisar tus calificaciones en el portal estudiantil, sección 'Historial académico'.",¿Cómo consulto mis calificaciones del semestre? calificaciones
¿Qué hacer si una calificación no aparece en el sistema?,calificaciones,Debes comunicarte con el docente responsable y notificar a la coordinación académica para su revisión.,¿Qué hacer si una calificación no aparece en el sistema? Debes comunicarte con el docente responsable y notificar a la coordinación académica para su revisión.,¿Qué hacer si una calificación no aparece en el sistema? calificaciones
¿Cómo es el procedimiento para pedir revisión de una nota final?,calificaciones,Debes llenar un formulario oficial y entregarlo en coordinación académica dentro de los 5 días hábiles siguientes a la publicación de la nota.,¿Cómo es el procedimiento para pedir revisión de una nota final? Debes llenar un formulario oficial y entregarlo en coordinación académica dentro de los 5 días hábiles siguientes a la publicación de la nota.,¿Cómo es el procedimiento para pedir revisión de una nota final? calificaciones
¿Existe algún recurso académico para cuestionar una calificación?,calificaciones,"Sí, puedes presentar una apelación formal ante el comité académico con evidencia de tu solicitud.","¿Existe algún recurso académico para cuestionar una calificación? Sí, puedes presentar una apelación formal ante el comité académico con evidencia de tu solicitud.",¿Existe algún recurso académico para cuestionar una calificación? calificaciones
¿Cuál es el promedio mínimo para mantener una beca?,calificaciones,Debes mantener un promedio acumulado mínimo de 4.0 para conservar tu beca académica.,¿Cuál es el promedio mínimo para mantener una beca? Debes mantener un promedio acumulado mínimo de 4.0 para conservar tu beca académica.,¿Cuál es el promedio mínimo para mantener una beca? calificaciones
¿Qué certificado médico necesito para inscribirme en actividades deportivas?,requisitos,Debes presentar un certificado de aptitud física emitido por un profesional de la salud.,¿Qué certificado médico necesito para inscribirme en actividades deportivas? Debes presentar un certificado de aptitud física emitido por un profesional de la salud.,¿Qué certificado médico necesito para inscribirme en actividades deportivas? requisitos
¿Es necesario presentar el certificado de afiliación a salud para la inscripción?,requisitos,"Sí, es obligatorio contar con seguro médico vigente para completar tu inscripción.","¿Es necesario presentar el certificado de afiliación a salud para la inscripción? Sí, es obligatorio contar con seguro médico vigente para completar tu inscripción.",¿Es necesario presentar el certificado de afiliación a salud para la inscripción? requisitos
¿Se aceptan fotocopias de documentos como requisitos?,requisitos,Generalmente se requieren originales para verificación. Consulta si puedes presentar copias autenticadas.,¿Se aceptan fotocopias de documentos como requisitos? Generalmente se requieren originales para verificación. Consulta si puedes presentar copias autenticadas.,¿Se aceptan fotocopias de documentos como requisitos? requisitos
¿Cuántas fotos tamaño carnet debo entregar?,requisitos,"Debes entregar 4 fotos recientes tamaño carnet, en fondo blanco y sin accesorios.","¿Cuántas fotos tamaño carnet debo entregar? Debes entregar 4 fotos recientes tamaño carnet, en fondo blanco y sin accesorios.",¿Cuántas fotos tamaño carnet debo entregar? requisitos
¿Puedo inscribirme con pasaporte si soy extranjero?,requisitos,"Sí, el pasaporte vigente es un documento válido de identificación para estudiantes internacionales.","¿Puedo inscribirme con pasaporte si soy extranjero? Sí, el pasaporte vigente es un documento válido de identificación para estudiantes internacionales.",¿Puedo inscribirme con pasaporte si soy extranjero? requisitos
¿Cuándo se publican las calificaciones finales?,calificaciones,Se publican al finalizar el periodo de exámenes. Puedes consultarlas en el portal estudiantil.,¿Cuándo se publican las calificaciones finales? Se publican al finalizar el periodo de exámenes. Puedes consultarlas en el portal estudiantil.,¿Cuándo se publican las calificaciones finales? calificaciones
¿Cómo calcular mi promedio acumulado?,calificaciones,Suma el total de notas ponderadas y divídelo entre el número total de créditos cursados.,¿Cómo calcular mi promedio acumulado? Suma el total de notas ponderadas y divídelo entre el número total de créditos cursados.,¿Cómo calcular mi promedio acumulado? calificaciones
¿Qué nota se requiere para aprobar una materia teórica?,calificaciones,Debes obtener una calificación mínima de 3.0 sobre 5.0 para aprobar.,¿Qué nota se requiere para aprobar una materia teórica? Debes obtener una calificación mínima de 3.0 sobre 5.0 para aprobar.,¿Qué nota se requiere para aprobar una materia teórica? calificaciones
¿Qué significa tener una nota de 2.9 en una asignatura?,calificaciones,Significa que no alcanzaste el puntaje mínimo para aprobar. Deberás repetir o presentar recuperación si aplica.,¿Qué significa tener una nota de 2.9 en una asignatura? Significa que no alcanzaste el puntaje mínimo para aprobar. Deberás repetir o presentar recuperación si aplica.,¿Qué significa tener una nota de 2.9 en una asignatura? calificaciones
¿Cuál es el rango de calificación en el sistema universitario?,calificaciones,"Generalmente de 0.0 a 5.0, siendo 3.0 la nota mínima aprobatoria. Consulta el reglamento académico para tu institución.","¿Cuál es el rango de calificación en el sistema universitario? Generalmente de 0.0 a 5.0, siendo 3.0 la nota mínima aprobatoria. Consulta el reglamento académico para tu institución.",¿Cuál es el rango de calificación en el sistema universitario? calificaciones
¿Cómo puedo tramitar mi carné universitario por primera vez?,tramites,Debes solicitarlo en servicios escolares presentando tu comprobante de inscripción y una fotografía reciente.,¿Cómo puedo tramitar mi carné universitario por primera vez? Debes solicitarlo en servicios escolares presentando tu comprobante de inscripción y una fotografía reciente.,¿Cómo puedo tramitar mi carné universitario por primera vez? tramites
¿Qué requisitos hay para pedir constancia de estudios para visa?,tramites,"Debes presentar tu pasaporte, comprobante de inscripción y carta de solicitud firmada.","¿Qué requisitos hay para pedir constancia de estudios para visa? Debes presentar tu pasaporte, comprobante de inscripción y carta de solicitud firmada.",¿Qué requisitos hay para pedir constancia de estudios para visa? tramites
¿Puedo gestionar mis trámites académicos en línea?,tramites,"Sí, muchos trámites como constancias y certificados pueden gestionarse desde el portal estudiantil.","¿Puedo gestionar mis trámites académicos en línea? Sí, muchos trámites como constancias y certificados pueden gestionarse desde el portal estudiantil.",¿Puedo gestionar mis trámites académicos en línea? tramites
¿Qué hacer si no aparece mi certificado de notas en el sistema?,tramites,Contacta al área de servicios escolares y verifica si hay un retraso o falta algún documento.,¿Qué hacer si no aparece mi certificado de notas en el sistema? Contacta al área de servicios escolares y verifica si hay un retraso o falta algún documento.,¿Qué hacer si no aparece mi certificado de notas en el sistema? tramites
¿Dónde actualizo mis datos personales institucionales?,tramites,Debes ingresar al portal estudiantil o acudir personalmente a servicios escolares con tu documento de identidad.,¿Dónde actualizo mis datos personales institucionales? Debes ingresar al portal estudiantil o acudir personalmente a servicios escolares con tu documento de identidad.,¿Dónde actualizo mis datos personales institucionales? tramites
¿Cómo se realiza el trámite administrativo para solicitar una doble titulación?,tramites,"Debes presentar carta de motivos, historial académico, y obtener autorización de ambos programas académicos.","¿Cómo se realiza el trámite administrativo para solicitar una doble titulación? Debes presentar carta de motivos, historial académico, y obtener autorización de ambos programas académicos.",¿Cómo se realiza el trámite administrativo para solicitar una doble titulación? tramites
¿Cuánto tarda el proceso de certificación de notas?,tramites,El trámite puede tardar entre 3 a 5 días hábiles. Verifica con servicios escolares el estado de tu solicitud.,¿Cuánto tarda el proceso de certificación de notas? El trámite puede tardar entre 3 a 5 días hábiles. Verifica con servicios escolares el estado de tu solicitud.,¿Cuánto tarda el proceso de certificación de notas? tramites
¿Puedo autorizar a un familiar para realizar trámites académicos?,tramites,"Sí, mediante una carta poder firmada, copia de tu documento y el de la persona autorizada.","¿Puedo autorizar a un familiar para realizar trámites académicos? Sí, mediante una carta poder firmada, copia de tu documento y el de la persona autorizada.",¿Puedo autorizar a un familiar para realizar trámites académicos? tramites
¿Dónde solicito mi historial académico completo?,tramites,Puedes solicitarlo en servicios escolares o descargarlo desde el portal institucional con tu usuario.,¿Dónde solicito mi historial académico completo? Puedes solicitarlo en servicios escolares o descargarlo desde el portal institucional con tu usuario.,¿Dónde solicito mi historial académico completo? tramites
¿Qué hacer si mi constancia de egreso tiene un error?,tramites,Solicita la corrección en servicios escolares llevando el documento con error y tu identificación.,¿Qué hacer si mi constancia de egreso tiene un error? Solicita la corrección en servicios escolares llevando el documento con error y tu identificación.,¿Qué hacer si mi constancia de egreso tiene un error? tramites
¿Es posible digitalizar mis certificados anteriores?,tramites,"Sí, puedes solicitar copias digitales de tus certificados antiguos presentando tu número de matrícula.","¿Es posible digitalizar mis certificados anteriores? Sí, puedes solicitar copias digitales de tus certificados antiguos presentando tu número de matrícula.",¿Es posible digitalizar mis certificados anteriores? tramites
¿Puedo tramitar documentos en vacaciones?,tramites,Algunos trámites pueden realizarse en línea durante vacaciones. Verifica los horarios especiales de atención.,¿Puedo tramitar documentos en vacaciones? Algunos trámites pueden realizarse en línea durante vacaciones. Verifica los horarios especiales de atención.,¿Puedo tramitar documentos en vacaciones? tramites
¿Qué es una certificación académica legalizada?,tramites,Es un documento oficial validado para uso internacional mediante firma y sello de la secretaría académica.,¿Qué es una certificación académica legalizada? Es un documento oficial validado para uso internacional mediante firma y sello de la secretaría académica.,¿Qué es una certificación académica legalizada? tramites
¿Cómo gestiono una baja definitiva del programa?,tramites,"Debes solicitarla mediante formato oficial, entrevista con coordinación y entrega de tus documentos académicos.","¿Cómo gestiono una baja definitiva del programa? Debes solicitarla mediante formato oficial, entrevista con coordinación y entrega de tus documentos académicos.",¿Cómo gestiono una baja definitiva del programa? tramites
¿Dónde consulto el estado de mis trámites académicos?,tramites,"En el portal estudiantil, sección 'Estado de trámites', o directamente en ventanilla de servicios escolares.","¿Dónde consulto el estado de mis trámites académicos? En el portal estudiantil, sección 'Estado de trámites', o directamente en ventanilla de servicios escolares.",¿Dónde consulto el estado de mis trámites académicos? tramites
¿Dónde puedo estudiar en silencio dentro del campus?,instalaciones,Puedes usar las salas silenciosas de la biblioteca o las aulas de estudio del edificio H.,¿Dónde puedo estudiar en silencio dentro del campus? Puedes usar las salas silenciosas de la biblioteca o las aulas de estudio del edificio H.,¿Dónde puedo estudiar en silencio dentro del campus? instalaciones
¿Las aulas tienen acceso a energía para laptops?,instalaciones,"Sí, la mayoría cuenta con tomas eléctricas distribuidas en las mesas o paredes laterales.","¿Las aulas tienen acceso a energía para laptops? Sí, la mayoría cuenta con tomas eléctricas distribuidas en las mesas o paredes laterales.",¿Las aulas tienen acceso a energía para laptops? instalaciones
